{
  "artifacts": {
    "baseline_audit": "/Users/farricecain/Google Antigravity/.tmp/codex-worktrees/search-content-mastery/_active/search-content-mastery/angle-map-search-answer-prototype/baseline-audit.md",
    "entity_context_pack": "/Users/farricecain/Google Antigravity/.tmp/codex-worktrees/search-content-mastery/_active/search-content-mastery/angle-map-search-answer-prototype/entity-context-pack.md",
    "evaluation_receipt": "/Users/farricecain/Google Antigravity/.tmp/codex-worktrees/search-content-mastery/_active/search-content-mastery/angle-map-search-answer-prototype/project-pack/scores/score-fe0bf69c65c4.json",
    "experiment_plan": "/Users/farricecain/Google Antigravity/.tmp/codex-worktrees/search-content-mastery/_active/search-content-mastery/angle-map-search-answer-prototype/experiment-plan.md",
    "improved_answer_asset": "/Users/farricecain/Google Antigravity/.tmp/codex-worktrees/search-content-mastery/_active/search-content-mastery/angle-map-search-answer-prototype/owned-answer-page.md",
    "intake": "/Users/farricecain/Google Antigravity/.tmp/codex-worktrees/search-content-mastery/_active/search-content-mastery/angle-map-search-answer-prototype/intake.md",
    "media_brief": "/Users/farricecain/Google Antigravity/.tmp/codex-worktrees/search-content-mastery/_active/search-content-mastery/angle-map-search-answer-prototype/proof-to-angle-media-brief.md",
    "opportunity_map": "/Users/farricecain/Google Antigravity/.tmp/codex-worktrees/search-content-mastery/_active/search-content-mastery/angle-map-search-answer-prototype/opportunity-map.md",
    "project_manifest": "/Users/farricecain/Google Antigravity/.tmp/codex-worktrees/search-content-mastery/_active/search-content-mastery/angle-map-search-answer-prototype/project-pack/manifest.json"
  },
  "boundaries": [
    "The service guarantees the scoped analysis and artifacts, not rankings, citations, traffic, leads, conversions, or revenue.",
    "No publication, outreach, connector write, payment setup, or offer replacement occurred.",
    "The Angle Map remains the live offer canon."
  ],
  "created_at": "2026-08-05T15:30:12.504053+00:00",
  "delivery_state": "READY_FOR_INTERNAL_REVIEW",
  "project_id": "the-angle-map-search-answer-prototype",
  "proof_gaps": [
    "No external market event has tested willingness to pay for this prototype.",
    "No dated ranking, citation, traffic, conversion, or collected-revenue outcome is attributed to this delivery."
  ],
  "prototype_state": "UNTESTED",
  "record_type": "ServiceReceipt",
  "schema_version": "service-receipt/v1",
  "service_id": "service-9adc4e1b9e52"
}
